{"contract_version":1,"issues":[],"kind":"perf_data_validation_report","metadata":{"build_isa":null,"commit_hash":"992a5362380efd1d4f5f2f490a08b56d9a5b407f","file":{"bytes":"506","path":"14-openblas_rv64_metadata.json","sha256":"bae284f21a62998e1b93fa41e7e8cc233ac8701117f1b3d2cbcdbfac93c4c75d"},"issues":[],"repository_url":"https://github.com/OpenMathLib/OpenBLAS.git","status":"present","test_branch":"develop"},"report_status":"usable","testcases":[{"annotate_directory":"dgemv_2048x2048/annotate","annotates":[{"file":{"bytes":"3367","path":"dgemv_2048x2048/annotate/001-dgemv_n-annotate.txt","sha256":"1e42a9afcc5bac0348f0075e587efa0dc9297bc0b568e1cb83dd61d0d33ff6f3"},"function":"dgemv_n","rank":"001"}],"issues":[],"name":"dgemv_2048x2048","perf_stat":{"bytes":"2015","path":"dgemv_2048x2048/14-openblas-benchmark-riscv-dgemv_2048x2048.txt","sha256":"03f50a1c0a3766ee1b62901d688faa959acff30e60ddbb60a1063d8243e882a0"},"status":"valid"}]}
